{
  "id": "vera-cruz",
  "version": "1.0.0",
  "territorioId": "ti-26",
  "tipo": "municipio",
  "rede": true,
  "meta": {
    "nome": "Vera Cruz",
    "coords": [-12.9608, -38.6099],
    "municipio": "Vera Cruz",
    "uf": "BA",
    "fonte": "Movimento Irun — cartografia REDE",
    "responsavel": "Rede Movimento Irun",
    "licenca": "CC BY-NC-SA 4.0",
    "updatedAt": "2026-06-06"
  },
  "sidebar": {
    "apresentacao": "Vera Cruz situa-se na ilha de Itaparica, na Baía de Todos os Santos, e concentra referências quilombolas como Tereré e Maragojipinho. Na REDE, articula turismo comunitário, memória viva e projetos como Vamos Navegar.",
    "identidade": [
      { "id": "historia", "titulo": "História e memória", "conteudo": "Território de quilombos históricos e comunidades pesqueiras na baía." },
      { "id": "comunidade", "titulo": "Comunidade", "conteudo": "Articulação entre município, quilombos vizinhos e projetos culturais na costa." },
      { "id": "turismo", "titulo": "Turismo", "conteudo": "Portal para o Quilombo do Tereré e roteiros intermunicipais com Itaparica." }
    ],
    "roteiros": [
      { "titulo": "Contra Costa", "descricao": "Ligação com Itaparica pelo roteiro de costa da ilha." }
    ],
    "fotos": [],
    "videos": [],
    "links": []
  }
}
